{
  "data": [
    {
      "time_left": 1.35,
      "bike_count": 37.53,
      "bike_distance": 19696160.0,
      "bike_time": 1.328,
      "walk_time": 2.641,
      "wait_time": 0.5,
      "reward": 17.66,
      "future_system_fail_count": 114.8
    },
    {
      "time_left": 0.41,
      "bike_count": 0.72,
      "bike_distance": 240947,
      "bike_time": 0.015,
      "walk_time": 0.016,
      "wait_time": 0.28,
      "reward": 0.55,
      "future_system_fail_count": 1.8
    },
    276,
    31.166754007339478
  ],
  "user_parms": {
    "absolute_margin_of_error": 0.1,
    "agent_mode": "smart",
    "batch_mode": "fixed_sample_size",
    "batch_size": 400,
    "confidence_level": 0.99,
    "empty_bias": 0.0,
    "end_station": 25,
    "excursion_time": 4.0,
    "full_bias": 0.0,
    "max_runtime": 30.0,
    "min_sample_size": 300,
    "parallel_batch_size": 12,
    "relative_margin_of_error": 0.1,
    "seed": 3158495187,
    "sim_mode": "batch",
    "start_station": 100,
    "use_static_seed": false,
    "warmup_time": 0.0
  },
  "report": "external\\results\\250427_1916_batch.json\n\nBatch Simulation (fixed sample size)\nReplication Count: 276\nTotal Runtime: 31.166754 seconds\nWarning: Max runtime exceeded. Target sample size not reached.\n\nParameters\nAgent Mode: Smart\nStart Station: 100\nEnd Station: 25\nExcursion Time: 4.0 hours\nWarmup Time: 0.0 hours\nEmpty Station Bias: 0.0\nFull Station Bias: 0.0\nConfidence Level: 0.99\nParallel Batch Size: 12\n\nResults\n(Expected values for a single run)\nTotal Reward: 17.66 \u00b1 0.55\nPunctuality: 1.35 \u00b1 0.41 minutes early\nBikes Rented: 37.53 \u00b1 0.72\nTotal Distance Biked: 2.641 \u00b1 0.016 km\nTotal Time Biking: 1.328 \u00b1 0.015 hours\nTotal Time Walking: 2.641 \u00b1 0.016 hours\nTotal Time Waiting: 0.5 \u00b1 0.28 minutes\nExpected Future Failures: 114.8 \u00b1 1.8\n"
}