{
  "data": [
    {
      "time_left": 1.46,
      "bike_count": 37.72,
      "bike_distance": 19757976.0,
      "bike_time": 1.3207,
      "walk_time": 2.6476,
      "wait_time": 0.44,
      "reward": 17.04,
      "future_system_fail_count": 114.06
    },
    {
      "time_left": 0.17,
      "bike_count": 0.42,
      "bike_distance": 122617,
      "bike_time": 0.0074,
      "walk_time": 0.0076,
      "wait_time": 0.15,
      "reward": 0.24,
      "future_system_fail_count": 0.93
    },
    564,
    60.69231986999512
  ],
  "user_parms": {
    "absolute_margin_of_error": 0.1,
    "agent_mode": "smart",
    "batch_mode": "precision_based",
    "batch_size": 400,
    "confidence_level": 0.95,
    "empty_bias": 0.0,
    "end_station": 25,
    "excursion_time": 4.0,
    "full_bias": 0.0,
    "max_runtime": 60.0,
    "min_sample_size": 300,
    "parallel_batch_size": 12,
    "relative_margin_of_error": 0.1,
    "seed": 3158495187,
    "sim_mode": "batch",
    "start_station": 100,
    "use_static_seed": false,
    "warmup_time": 0.0
  },
  "report": "external\\results\\250427_1855_batch.json\n\nBatch Simulation (precision-based)\nReplication Count: 564\nTotal Runtime: 60.692320 seconds\nWarning: Max runtime exceeded. Target precision for result estimations not reached.\n\nParameters\nAgent Mode: Smart\nStart Station: 100\nEnd Station: 25\nExcursion Time: 4.0 hours\nWarmup Time: 0.0 hours\nEmpty Station Bias: 0.0\nFull Station Bias: 0.0\nConfidence Level: 0.95\nParallel Batch Size: 12\nMin Sample Size: 300 runs\n\nResults\n(Expected values for a single run)\nTotal Reward: 17.04 \u00b1 0.24\nPunctuality: 1.46 \u00b1 0.17 minutes early\nBikes Rented: 37.72 \u00b1 0.42\nTotal Distance Biked: 2.6476 \u00b1 0.0076 km\nTotal Time Biking: 1.3207 \u00b1 0.0074 hours\nTotal Time Walking: 2.6476 \u00b1 0.0076 hours\nTotal Time Waiting: 0.44 \u00b1 0.15 minutes\nExpected Future Failures: 114.06 \u00b1 0.93\n"
}