{
  "data": [
    {
      "time_left": -0.1,
      "bike_count": 35.5,
      "bike_distance": 19115904.0,
      "bike_time": 1.2914,
      "walk_time": 2.6814,
      "wait_time": 1.7,
      "reward": 14.84,
      "future_system_fail_count": 115.44
    },
    {
      "time_left": 0.1,
      "bike_count": 0.3,
      "bike_distance": 49344,
      "bike_time": 0.0032,
      "walk_time": 0.0032,
      "wait_time": 0.1,
      "reward": 0.11,
      "future_system_fail_count": 0.47
    },
    3864,
    41.20788311958313
  ],
  "user_parms": {
    "absolute_margin_of_error": 0.1,
    "agent_mode": "basic",
    "batch_mode": "precision_based",
    "batch_size": 400,
    "confidence_level": 0.99,
    "empty_bias": 0.0,
    "end_station": 25,
    "excursion_time": 4.0,
    "full_bias": 0.0,
    "max_runtime": 120.0,
    "min_sample_size": 300,
    "parallel_batch_size": 12,
    "relative_margin_of_error": 0.1,
    "seed": 3158495187,
    "sim_mode": "batch",
    "start_station": 100,
    "use_static_seed": false,
    "warmup_time": 0.0
  },
  "report": "external\\results\\250427_1858_batch.json\n\nBatch Simulation (precision-based)\nReplication Count: 3864\nTotal Runtime: 41.207883 seconds\n\nParameters\nAgent Mode: Basic\nStart Station: 100\nEnd Station: 25\nExcursion Time: 4.0 hours\nWarmup Time: 0.0 hours\nEmpty Station Bias: 0.0\nFull Station Bias: 0.0\nConfidence Level: 0.99\nParallel Batch Size: 12\nMin Sample Size: 300 runs\n\nResults\n(Expected values for a single run)\nTotal Reward: 14.84 \u00b1 0.11\nPunctuality: 0.1 \u00b1 0.1 minutes late\nBikes Rented: 35.5 \u00b1 0.3\nTotal Distance Biked: 2.6814 \u00b1 0.0032 km\nTotal Time Biking: 1.2914 \u00b1 0.0032 hours\nTotal Time Walking: 2.6814 \u00b1 0.0032 hours\nTotal Time Waiting: 1.7 \u00b1 0.1 minutes\nExpected Future Failures: 115.44 \u00b1 0.47\n"
}