{
  "data": [
    {
      "time_left": 0.984,
      "bike_count": 37.5,
      "bike_distance": 19290111.0,
      "bike_time": 1.3062,
      "walk_time": 2.6649,
      "wait_time": 0.8,
      "reward": 17.11,
      "future_system_fail_count": 113.49
    },
    {
      "time_left": 0.075,
      "bike_count": 0.17,
      "bike_distance": 53255,
      "bike_time": 0.0035,
      "walk_time": 0.0039,
      "wait_time": 0.1,
      "reward": 0.11,
      "future_system_fail_count": 0.51
    },
    336,
    30.988819360733032
  ],
  "user_parms": {
    "absolute_margin_of_error": 0.1,
    "agent_mode": "smart",
    "batch_mode": "precision_based",
    "batch_size": 300,
    "confidence_level": 0.5,
    "empty_bias": 0.0,
    "end_station": 110,
    "excursion_time": 4.0,
    "full_bias": 0.0,
    "max_runtime": 30.0,
    "min_sample_size": 300,
    "parallel_batch_size": 12,
    "relative_margin_of_error": 0.01,
    "seed": 3158495187,
    "sim_mode": "batch",
    "start_station": 99,
    "use_static_seed": true,
    "warmup_time": 0.0
  },
  "report": "external/results/250425_1350_batch.json\n\nBatch Simulation\nReplication Count: 336\nReal Runtime: 30.988819 seconds\nWarning: Max runtime exceeded. Target precision for result estimations not reached.\n\nParameters\nAgent Mode: Smart\nStart Station: 99\nEnd Station: 110\nExcursion Time: 4.0 hours\nWarmup Time: 0.0 hours\nEmpty Station Bias: 0.0\nFull Station Bias: 0.0\nConfidence Level: 0.5\nParallel Batch Size: 12\nMin Sample size: 300 runs\n\nResults\n(Expected values for a single run)\nTotal Reward: 17.11\u00b10.11\nPunctuality: 0.984\u00b10.075 minutes early\nBikes Rented: 37.5\u00b10.17\nTotal Distance Biked: 2.6649\u00b10.0039 km\n Total Time Biking: 1.3062\u00b10.0035\nTotal Time Walking: 2.6649\u00b10.0039 hours\nTotal Time Waiting: 0.8\u00b10.1 minutes\nExpected Future Failures: 113.49\u00b10.51\n"
}