{
  "data": [
    {
      "time_left": 0.648,
      "bike_count": 36.8,
      "bike_distance": 19730660.0,
      "bike_time": 1.3095,
      "walk_time": 2.669,
      "wait_time": 0.64,
      "reward": 16.517,
      "future_system_fail_count": 116.84
    },
    {
      "time_left": 0.069,
      "bike_count": 0.2,
      "bike_distance": 65636,
      "bike_time": 0.0037,
      "walk_time": 0.0039,
      "wait_time": 0.09,
      "reward": 0.078,
      "future_system_fail_count": 0.53
    },
    300,
    26.360401391983032
  ],
  "user_parms": {
    "absolute_margin_of_error": 0.1,
    "agent_mode": "smart",
    "batch_mode": "fixed_sample_size",
    "batch_size": 300,
    "confidence_level": 0.5,
    "empty_bias": 0.0,
    "end_station": 110,
    "excursion_time": 4.0,
    "full_bias": 0.0,
    "max_runtime": 60.0,
    "min_sample_size": 300,
    "parallel_batch_size": 12,
    "relative_margin_of_error": 0.05,
    "seed": 3158495187,
    "sim_mode": "batch",
    "start_station": 99,
    "use_static_seed": true,
    "warmup_time": 0.0
  },
  "report": "external/results/250425_1443_batch.json\n\nBatch Simulation\nReplication Count: 300\nTotal Runtime: 26.360401 seconds\n\nParameters\nAgent Mode: Smart\nStart Station: 99\nEnd Station: 110\nExcursion Time: 4.0 hours\nWarmup Time: 0.0 hours\nEmpty Station Bias: 0.0\nFull Station Bias: 0.0\nConfidence Level: 0.5\nParallel Batch Size: 12\nMin Sample size: 300 runs\n\nResults\n(Expected values for a single run)\nTotal Reward: 16.517 \u00b1 0.078\nPunctuality: 0.648 \u00b1 0.069 minutes early\nBikes Rented: 36.8 \u00b1 0.2\nTotal Distance Biked: 2.669 \u00b1 0.0039 km\nTotal Time Biking: 1.3095 \u00b1 0.0037\nTotal Time Walking: 2.669 \u00b1 0.0039 hours\nTotal Time Waiting: 0.64 \u00b1 0.09 minutes\nExpected Future Failures: 116.84 \u00b1 0.53\n"
}