{
  "data": [
    {
      "time_left": -0.3,
      "bike_count": 35.62,
      "bike_distance": 19095232.0,
      "bike_time": 1.2903,
      "walk_time": 2.6824,
      "wait_time": 1.9,
      "reward": 14.85,
      "future_system_fail_count": 115.06
    },
    {
      "time_left": 0.1,
      "bike_count": 0.31,
      "bike_distance": 48544,
      "bike_time": 0.0032,
      "walk_time": 0.0032,
      "wait_time": 0.1,
      "reward": 0.12,
      "future_system_fail_count": 0.47
    },
    2148,
    23.910271883010864
  ],
  "user_parms": {
    "absolute_margin_of_error": 0.1,
    "agent_mode": "basic",
    "batch_mode": "precision_based",
    "batch_size": 400,
    "confidence_level": 0.95,
    "empty_bias": 0.0,
    "end_station": 25,
    "excursion_time": 4.0,
    "full_bias": 0.0,
    "max_runtime": 60.0,
    "min_sample_size": 300,
    "parallel_batch_size": 12,
    "relative_margin_of_error": 0.1,
    "seed": 3158495187,
    "sim_mode": "batch",
    "start_station": 100,
    "use_static_seed": false,
    "warmup_time": 0.0
  },
  "report": "external\\results\\250427_1857_batch.json\n\nBatch Simulation (precision-based)\nReplication Count: 2148\nTotal Runtime: 23.910272 seconds\n\nParameters\nAgent Mode: Basic\nStart Station: 100\nEnd Station: 25\nExcursion Time: 4.0 hours\nWarmup Time: 0.0 hours\nEmpty Station Bias: 0.0\nFull Station Bias: 0.0\nConfidence Level: 0.95\nParallel Batch Size: 12\nMin Sample Size: 300 runs\n\nResults\n(Expected values for a single run)\nTotal Reward: 14.85 \u00b1 0.12\nPunctuality: 0.3 \u00b1 0.1 minutes late\nBikes Rented: 35.62 \u00b1 0.31\nTotal Distance Biked: 2.6824 \u00b1 0.0032 km\nTotal Time Biking: 1.2903 \u00b1 0.0032 hours\nTotal Time Walking: 2.6824 \u00b1 0.0032 hours\nTotal Time Waiting: 1.9 \u00b1 0.1 minutes\nExpected Future Failures: 115.06 \u00b1 0.47\n"
}