{
  "data": [
    {
      "time_left": 1.17,
      "bike_count": 36.36,
      "bike_distance": 19436608.0,
      "bike_time": 1.298,
      "walk_time": 2.6643,
      "wait_time": 1.11,
      "reward": 16.99,
      "future_system_fail_count": 113.12
    },
    {
      "time_left": 0.11,
      "bike_count": 0.18,
      "bike_distance": 41685,
      "bike_time": 0.003,
      "walk_time": 0.0031,
      "wait_time": 0.12,
      "reward": 0.11,
      "future_system_fail_count": 0.39
    },
    300,
    30.89191722869873
  ],
  "user_parms": {
    "absolute_margin_of_error": 0.1,
    "agent_mode": "smart",
    "batch_mode": "fixed_sample_size",
    "batch_size": 300,
    "confidence_level": 0.5,
    "empty_bias": 0.0,
    "end_station": 110,
    "excursion_time": 4.0,
    "full_bias": 0.0,
    "max_runtime": 60.0,
    "min_sample_size": 300,
    "parallel_batch_size": 12,
    "relative_margin_of_error": 0.05,
    "seed": 3158495187,
    "sim_mode": "batch",
    "start_station": 99,
    "use_static_seed": true,
    "warmup_time": 0.0
  },
  "report": "external/results/250425_1455_batch.json\n\nBatch Simulation\nReplication Count: 300\nTotal Runtime: 30.891917 seconds\n\nParameters\nAgent Mode: Smart\nStart Station: 99\nEnd Station: 110\nExcursion Time: 4.0 hours\nWarmup Time: 0.0 hours\nEmpty Station Bias: 0.0\nFull Station Bias: 0.0\nConfidence Level: 0.5\nParallel Batch Size: 12\nSample Size: 300 runs\n\nResults\n(Expected values for a single run)\nTotal Reward: 16.99 \u00b1 0.11\nPunctuality: 1.17 \u00b1 0.11 minutes early\nBikes Rented: 36.36 \u00b1 0.18\nTotal Distance Biked: 2.6643 \u00b1 0.0031 km\nTotal Time Biking: 1.298 \u00b1 0.003\nTotal Time Walking: 2.6643 \u00b1 0.0031 hours\nTotal Time Waiting: 1.11 \u00b1 0.12 minutes\nExpected Future Failures: 113.12 \u00b1 0.39\n"
}