{
  "data": [
    {
      "time_left": 1.53,
      "bike_count": 38.07,
      "bike_distance": 19765890.0,
      "bike_time": 1.323,
      "walk_time": 2.646,
      "wait_time": 0.35,
      "reward": 17.14,
      "future_system_fail_count": 114.29
    },
    {
      "time_left": 0.15,
      "bike_count": 0.38,
      "bike_distance": 118783,
      "bike_time": 0.0069,
      "walk_time": 0.007,
      "wait_time": 0.12,
      "reward": 0.23,
      "future_system_fail_count": 0.93
    },
    1116,
    120.73769903182983
  ],
  "user_parms": {
    "absolute_margin_of_error": 0.1,
    "agent_mode": "smart",
    "batch_mode": "precision_based",
    "batch_size": 400,
    "confidence_level": 0.99,
    "empty_bias": 0.0,
    "end_station": 25,
    "excursion_time": 4.0,
    "full_bias": 0.0,
    "max_runtime": 120.0,
    "min_sample_size": 300,
    "parallel_batch_size": 12,
    "relative_margin_of_error": 0.1,
    "seed": 3158495187,
    "sim_mode": "batch",
    "start_station": 100,
    "use_static_seed": false,
    "warmup_time": 0.0
  },
  "report": "external\\results\\250427_1900_batch.json\n\nBatch Simulation (precision-based)\nReplication Count: 1116\nTotal Runtime: 120.737699 seconds\nWarning: Max runtime exceeded. Target precision for result estimations not reached.\n\nParameters\nAgent Mode: Smart\nStart Station: 100\nEnd Station: 25\nExcursion Time: 4.0 hours\nWarmup Time: 0.0 hours\nEmpty Station Bias: 0.0\nFull Station Bias: 0.0\nConfidence Level: 0.99\nParallel Batch Size: 12\nMin Sample Size: 300 runs\n\nResults\n(Expected values for a single run)\nTotal Reward: 17.14 \u00b1 0.23\nPunctuality: 1.53 \u00b1 0.15 minutes early\nBikes Rented: 38.07 \u00b1 0.38\nTotal Distance Biked: 2.646 \u00b1 0.007 km\nTotal Time Biking: 1.323 \u00b1 0.0069 hours\nTotal Time Walking: 2.646 \u00b1 0.007 hours\nTotal Time Waiting: 0.35 \u00b1 0.12 minutes\nExpected Future Failures: 114.29 \u00b1 0.93\n"
}