{
  "data": [
    {
      "time_left": 0.791,
      "bike_count": 36.58,
      "bike_distance": 18860421.0,
      "bike_time": 1.272,
      "walk_time": 2.698,
      "wait_time": 1.016,
      "reward": 18.011,
      "future_system_fail_count": 111.64
    },
    {
      "time_left": 0.065,
      "bike_count": 0.13,
      "bike_distance": 28229,
      "bike_time": 0.002,
      "walk_time": 0.002,
      "wait_time": 0.073,
      "reward": 0.073,
      "future_system_fail_count": 0.41
    },
    24,
    4.205608367919922
  ],
  "user_parms": {
    "absolute_margin_of_error": 0.1,
    "agent_mode": "smart",
    "batch_mode": "precision_based",
    "batch_size": 400,
    "confidence_level": 0.1,
    "empty_bias": 0.0,
    "end_station": 110,
    "excursion_time": 4.0,
    "full_bias": 0.0,
    "max_runtime": 30.0,
    "min_sample_size": 10,
    "parallel_batch_size": 12,
    "relative_margin_of_error": 0.1,
    "seed": 3158495187,
    "sim_mode": "batch",
    "start_station": 97,
    "use_static_seed": false,
    "warmup_time": 0.0
  },
  "report": "external\\results\\250427_1356_batch.json\n\nBatch Simulation\nReplication Count: 24\nTotal Runtime: 4.205608 seconds\n\nParameters\nAgent Mode: Smart\nStart Station: 97\nEnd Station: 110\nExcursion Time: 4.0 hours\nWarmup Time: 0.0 hours\nEmpty Station Bias: 0.0\nFull Station Bias: 0.0\nConfidence Level: 0.1\nParallel Batch Size: 12\nMin Sample Size: 10 runs\n\nResults\n(Expected values for a single run)\nTotal Reward: 18.011 \u00b1 0.073\nPunctuality: 0.791 \u00b1 0.065 minutes early\nBikes Rented: 36.58 \u00b1 0.13\nTotal Distance Biked: 2.698 \u00b1 0.002 km\nTotal Time Biking: 1.272 \u00b1 0.002\nTotal Time Walking: 2.698 \u00b1 0.002 hours\nTotal Time Waiting: 1.016 \u00b1 0.073 minutes\nExpected Future Failures: 111.64 \u00b1 0.41\n"
}