{
  "data": [
    {
      "time_left": 0.83,
      "bike_count": 38.02,
      "bike_distance": 18887544.0,
      "bike_time": 1.279,
      "walk_time": 2.7006,
      "wait_time": 0.4,
      "reward": 17.94,
      "future_system_fail_count": 114.69
    },
    {
      "time_left": 0.082,
      "bike_count": 0.24,
      "bike_distance": 62655,
      "bike_time": 0.004,
      "walk_time": 0.0042,
      "wait_time": 0.098,
      "reward": 0.19,
      "future_system_fail_count": 0.63
    },
    108,
    13.512425661087036
  ],
  "user_parms": {
    "absolute_margin_of_error": 0.1,
    "agent_mode": "smart",
    "batch_mode": "precision_based",
    "batch_size": 400,
    "confidence_level": 0.4,
    "empty_bias": 0.0,
    "end_station": 110,
    "excursion_time": 4.0,
    "full_bias": 0.0,
    "max_runtime": 30.0,
    "min_sample_size": 100,
    "parallel_batch_size": 12,
    "relative_margin_of_error": 0.1,
    "seed": 3158495187,
    "sim_mode": "batch",
    "start_station": 97,
    "use_static_seed": false,
    "warmup_time": 0.0
  },
  "report": "external\\results\\250427_1338_batch.json\n\nBatch Simulation\nReplication Count: 108\nTotal Runtime: 13.512426 seconds\n\nParameters\nAgent Mode: Smart\nStart Station: 97\nEnd Station: 110\nExcursion Time: 4.0 hours\nWarmup Time: 0.0 hours\nEmpty Station Bias: 0.0\nFull Station Bias: 0.0\nConfidence Level: 0.4\nParallel Batch Size: 12\nMin Sample Size: 100 runs\n\nResults\n(Expected values for a single run)\nTotal Reward: 17.94 \u00b1 0.19\nPunctuality: 0.83 \u00b1 0.082 minutes early\nBikes Rented: 38.02 \u00b1 0.24\nTotal Distance Biked: 2.7006 \u00b1 0.0042 km\nTotal Time Biking: 1.279 \u00b1 0.004\nTotal Time Walking: 2.7006 \u00b1 0.0042 hours\nTotal Time Waiting: 0.4 \u00b1 0.098 minutes\nExpected Future Failures: 114.69 \u00b1 0.63\n"
}