{
  "data": [
    {
      "time_left": 1.064,
      "bike_count": 37.496,
      "bike_distance": 19065028.0,
      "bike_time": 1.2791,
      "walk_time": 2.69841,
      "wait_time": 0.286,
      "reward": 17.496,
      "future_system_fail_count": 113.235
    },
    {
      "time_left": 0.013,
      "bike_count": 0.035,
      "bike_distance": 10708,
      "bike_time": 0.00062,
      "walk_time": 0.00064,
      "wait_time": 0.012,
      "reward": 0.026,
      "future_system_fail_count": 0.089
    },
    264,
    30.159311294555664
  ],
  "user_parms": {
    "absolute_margin_of_error": 0.1,
    "agent_mode": "smart",
    "batch_mode": "fixed_sample_size",
    "batch_size": 400,
    "confidence_level": 0.1,
    "empty_bias": 0.0,
    "end_station": 110,
    "excursion_time": 4.0,
    "full_bias": 0.0,
    "max_runtime": 30.0,
    "min_sample_size": 10,
    "parallel_batch_size": 12,
    "relative_margin_of_error": 0.1,
    "seed": 3158495187,
    "sim_mode": "batch",
    "start_station": 97,
    "use_static_seed": false,
    "warmup_time": 0.0
  },
  "report": "external\\results\\250427_1432_batch.json\n\nBatch Simulation\nReplication Count: 264\nTotal Runtime: 30.159311 seconds\nWarning: Max runtime exceeded. Target sample size not reached.\n\nParameters\nAgent Mode: Smart\nStart Station: 97\nEnd Station: 110\nExcursion Time: 4.0 hours\nWarmup Time: 0.0 hours\nEmpty Station Bias: 0.0\nFull Station Bias: 0.0\nConfidence Level: 0.1\nParallel Batch Size: 12\n\nResults\n(Expected values for a single run)\nTotal Reward: 17.496 \u00b1 0.026\nPunctuality: 1.064 \u00b1 0.013 minutes early\nBikes Rented: 37.496 \u00b1 0.035\nTotal Distance Biked: 2.69841 \u00b1 0.00064 km\nTotal Time Biking: 1.2791 \u00b1 0.00062\nTotal Time Walking: 2.69841 \u00b1 0.00064 hours\nTotal Time Waiting: 0.286 \u00b1 0.012 minutes\nExpected Future Failures: 113.235 \u00b1 0.089\n"
}