{
  "data": [
    {
      "time_left": 0.69,
      "bike_count": 39.58,
      "bike_distance": 19236250.0,
      "bike_time": 1.301,
      "walk_time": 2.6748,
      "wait_time": 0.782,
      "reward": 18.061,
      "future_system_fail_count": 111.78
    },
    {
      "time_left": 0.052,
      "bike_count": 0.14,
      "bike_distance": 44638,
      "bike_time": 0.002,
      "walk_time": 0.0022,
      "wait_time": 0.069,
      "reward": 0.071,
      "future_system_fail_count": 0.27
    },
    24,
    4.662574291229248
  ],
  "user_parms": {
    "absolute_margin_of_error": 0.1,
    "agent_mode": "smart",
    "batch_mode": "precision_based",
    "batch_size": 400,
    "confidence_level": 0.1,
    "empty_bias": 0.0,
    "end_station": 110,
    "excursion_time": 4.0,
    "full_bias": 0.0,
    "max_runtime": 30.0,
    "min_sample_size": 10,
    "parallel_batch_size": 12,
    "relative_margin_of_error": 0.1,
    "seed": 3158495187,
    "sim_mode": "batch",
    "start_station": 97,
    "use_static_seed": false,
    "warmup_time": 0.0
  },
  "report": "external\\results\\250427_1342_batch.json\n\nBatch Simulation\nReplication Count: 24\nTotal Runtime: 4.662574 seconds\n\nParameters\nAgent Mode: Smart\nStart Station: 97\nEnd Station: 110\nExcursion Time: 4.0 hours\nWarmup Time: 0.0 hours\nEmpty Station Bias: 0.0\nFull Station Bias: 0.0\nConfidence Level: 0.1\nParallel Batch Size: 12\nMin Sample Size: 10 runs\n\nResults\n(Expected values for a single run)\nTotal Reward: 18.061 \u00b1 0.071\nPunctuality: 0.69 \u00b1 0.052 minutes early\nBikes Rented: 39.58 \u00b1 0.14\nTotal Distance Biked: 2.6748 \u00b1 0.0022 km\nTotal Time Biking: 1.301 \u00b1 0.002\nTotal Time Walking: 2.6748 \u00b1 0.0022 hours\nTotal Time Waiting: 0.782 \u00b1 0.069 minutes\nExpected Future Failures: 111.78 \u00b1 0.27\n"
}