{
  "data": [
    {
      "time_left": 1.487,
      "bike_count": 37.6,
      "bike_distance": 18773275.0,
      "bike_time": 1.2627,
      "walk_time": 2.7125,
      "wait_time": 0.0,
      "reward": 17.37,
      "future_system_fail_count": 116.63
    },
    {
      "time_left": 0.055,
      "bike_count": 0.2,
      "bike_distance": 48932,
      "bike_time": 0.0024,
      "walk_time": 0.0028,
      "wait_time": 0,
      "reward": 0.14,
      "future_system_fail_count": 0.46
    },
    12,
    3.1957967281341553
  ],
  "user_parms": {
    "absolute_margin_of_error": 0.1,
    "agent_mode": "smart",
    "batch_mode": "precision_based",
    "batch_size": 400,
    "confidence_level": 0.1,
    "empty_bias": 0.0,
    "end_station": 25,
    "excursion_time": 4.0,
    "full_bias": 0.0,
    "max_runtime": 30.0,
    "min_sample_size": 10,
    "parallel_batch_size": 12,
    "relative_margin_of_error": 0.1,
    "seed": 3158495187,
    "sim_mode": "batch",
    "start_station": 100,
    "use_static_seed": false,
    "warmup_time": 0.0
  },
  "report": "external\\results\\250427_1446_batch.json\n\nBatch Simulation (precision-based)\nReplication Count: 12\nTotal Runtime: 3.195797 seconds\n\nParameters\nAgent Mode: Smart\nStart Station: 100\nEnd Station: 25\nExcursion Time: 4.0 hours\nWarmup Time: 0.0 hours\nEmpty Station Bias: 0.0\nFull Station Bias: 0.0\nConfidence Level: 0.1\nParallel Batch Size: 12\nMin Sample Size: 10 runs\n\nResults\n(Expected values for a single run)\nTotal Reward: 17.37 \u00b1 0.14\nPunctuality: 1.487 \u00b1 0.055 minutes early\nBikes Rented: 37.6 \u00b1 0.2\nTotal Distance Biked: 2.7125 \u00b1 0.0028 km\nTotal Time Biking: 1.2627 \u00b1 0.0024 hours\nTotal Time Walking: 2.7125 \u00b1 0.0028 hours\nTotal Time Waiting: 0.0 \u00b1 0 minutes\nExpected Future Failures: 116.63 \u00b1 0.46\n"
}