{
  "data": [
    {
      "time_left": 2.49,
      "bike_count": 36.0,
      "bike_distance": 20374660.0,
      "bike_time": 1.348,
      "walk_time": 2.611,
      "wait_time": 0.0,
      "reward": 15.86,
      "future_system_fail_count": 117.6
    },
    {
      "time_left": 0.37,
      "bike_count": 1.2,
      "bike_distance": 653874,
      "bike_time": 0.034,
      "walk_time": 0.038,
      "wait_time": 0,
      "reward": 0.54,
      "future_system_fail_count": 2.8
    },
    60,
    4.971749782562256
  ],
  "user_parms": {
    "absolute_margin_of_error": 0.1,
    "agent_mode": "smart",
    "batch_mode": "fixed_sample_size",
    "batch_size": 400,
    "confidence_level": 0.99,
    "empty_bias": 0.0,
    "end_station": 25,
    "excursion_time": 4.0,
    "full_bias": 0.0,
    "max_runtime": 4.0,
    "min_sample_size": 300,
    "parallel_batch_size": 12,
    "relative_margin_of_error": 0.1,
    "seed": 3158495187,
    "sim_mode": "batch",
    "start_station": 100,
    "use_static_seed": false,
    "warmup_time": 0.0
  },
  "report": "external/results/250427_1912_batch.json\n\nBatch Simulation (fixed sample size)\nReplication Count: 60\nTotal Runtime: 4.971750 seconds\nWarning: Max runtime exceeded. Target sample size not reached.\n\nParameters\nAgent Mode: Smart\nStart Station: 100\nEnd Station: 25\nExcursion Time: 4.0 hours\nWarmup Time: 0.0 hours\nEmpty Station Bias: 0.0\nFull Station Bias: 0.0\nConfidence Level: 0.99\nParallel Batch Size: 12\n\nResults\n(Expected values for a single run)\nTotal Reward: 15.86 \u00b1 0.54\nPunctuality: 2.49 \u00b1 0.37 minutes early\nBikes Rented: 36.0 \u00b1 1.2\nTotal Distance Biked: 2.611 \u00b1 0.038 km\nTotal Time Biking: 1.348 \u00b1 0.034 hours\nTotal Time Walking: 2.611 \u00b1 0.038 hours\nTotal Time Waiting: 0.0 \u00b1 0 minutes\nExpected Future Failures: 117.6 \u00b1 2.8\n"
}