{
  "data": [
    {
      "time_left": 0.875,
      "bike_count": 36.0,
      "bike_distance": 19461634.0,
      "bike_time": 1.2901,
      "walk_time": 2.6954,
      "wait_time": 0.0,
      "reward": 16.6,
      "future_system_fail_count": 118.4
    },
    {
      "time_left": 0.027,
      "bike_count": 0.14,
      "bike_distance": 45588,
      "bike_time": 0.0023,
      "walk_time": 0.0024,
      "wait_time": 0,
      "reward": 0.1,
      "future_system_fail_count": 0.41
    },
    348,
    30.838276624679565
  ],
  "user_parms": {
    "absolute_margin_of_error": 0.1,
    "agent_mode": "smart",
    "batch_mode": "fixed_sample_size",
    "batch_size": 400,
    "confidence_level": 0.5,
    "empty_bias": 0.0,
    "end_station": 110,
    "excursion_time": 4.0,
    "full_bias": 0.0,
    "max_runtime": 30.0,
    "min_sample_size": 300,
    "parallel_batch_size": 12,
    "relative_margin_of_error": 0.05,
    "seed": 3158495187,
    "sim_mode": "batch",
    "start_station": 99,
    "use_static_seed": true,
    "warmup_time": 0.0
  },
  "report": "external/results/250425_1458_batch.json\n\nBatch Simulation\nReplication Count: 348\nTotal Runtime: 30.838277 seconds\nWarning: Max runtime exceeded. Target sample size not reached.\n\nParameters\nAgent Mode: Smart\nStart Station: 99\nEnd Station: 110\nExcursion Time: 4.0 hours\nWarmup Time: 0.0 hours\nEmpty Station Bias: 0.0\nFull Station Bias: 0.0\nConfidence Level: 0.5\nParallel Batch Size: 12\nSample Size: 400 runs\n\nResults\n(Expected values for a single run)\nTotal Reward: 16.6 \u00b1 0.1\nPunctuality: 0.875 \u00b1 0.027 minutes early\nBikes Rented: 36.0 \u00b1 0.14\nTotal Distance Biked: 2.6954 \u00b1 0.0024 km\nTotal Time Biking: 1.2901 \u00b1 0.0023\nTotal Time Walking: 2.6954 \u00b1 0.0024 hours\nTotal Time Waiting: 0.0 \u00b1 0 minutes\nExpected Future Failures: 118.4 \u00b1 0.41\n"
}