{
  "data": [
    {
      "time_left": 1.089,
      "bike_count": 38.06,
      "bike_distance": 19046259.0,
      "bike_time": 1.2856,
      "walk_time": 2.6914,
      "wait_time": 0.286,
      "reward": 17.54,
      "future_system_fail_count": 113.01
    },
    {
      "time_left": 0.067,
      "bike_count": 0.21,
      "bike_distance": 63615,
      "bike_time": 0.0037,
      "walk_time": 0.0038,
      "wait_time": 0.065,
      "reward": 0.13,
      "future_system_fail_count": 0.51
    },
    264,
    30.84873938560486
  ],
  "user_parms": {
    "absolute_margin_of_error": 0.1,
    "agent_mode": "smart",
    "batch_mode": "fixed_sample_size",
    "batch_size": 400,
    "confidence_level": 0.5,
    "empty_bias": 0.0,
    "end_station": 110,
    "excursion_time": 4.0,
    "full_bias": 0.0,
    "max_runtime": 30.0,
    "min_sample_size": 300,
    "parallel_batch_size": 12,
    "relative_margin_of_error": 0.05,
    "seed": 3158495187,
    "sim_mode": "batch",
    "start_station": 97,
    "use_static_seed": false,
    "warmup_time": 0.0
  },
  "report": "external\\results\\250427_1233_batch.json\n\nBatch Simulation\nReplication Count: 264\nTotal Runtime: 30.848739 seconds\nWarning: Max runtime exceeded. Target sample size not reached.\n\nParameters\nAgent Mode: Smart\nStart Station: 97\nEnd Station: 110\nExcursion Time: 4.0 hours\nWarmup Time: 0.0 hours\nEmpty Station Bias: 0.0\nFull Station Bias: 0.0\nConfidence Level: 0.5\nParallel Batch Size: 12\nSample Size: 400 runs\n\nResults\n(Expected values for a single run)\nTotal Reward: 17.54 \u00b1 0.13\nPunctuality: 1.089 \u00b1 0.067 minutes early\nBikes Rented: 38.06 \u00b1 0.21\nTotal Distance Biked: 2.6914 \u00b1 0.0038 km\nTotal Time Biking: 1.2856 \u00b1 0.0037\nTotal Time Walking: 2.6914 \u00b1 0.0038 hours\nTotal Time Waiting: 0.286 \u00b1 0.065 minutes\nExpected Future Failures: 113.01 \u00b1 0.51\n"
}