{
  "data": [
    {
      "time_left": 1.235,
      "bike_count": 38.42,
      "bike_distance": 18753775.0,
      "bike_time": 1.2722,
      "walk_time": 2.7072,
      "wait_time": 0.0,
      "reward": 16.889,
      "future_system_fail_count": 116.88
    },
    {
      "time_left": 0.044,
      "bike_count": 0.14,
      "bike_distance": 45725,
      "bike_time": 0.0023,
      "walk_time": 0.0029,
      "wait_time": 0,
      "reward": 0.094,
      "future_system_fail_count": 0.38
    },
    12,
    2.953256368637085
  ],
  "user_parms": {
    "absolute_margin_of_error": 0.1,
    "agent_mode": "smart",
    "batch_mode": "precision_based",
    "batch_size": 400,
    "confidence_level": 0.1,
    "empty_bias": 0.0,
    "end_station": 110,
    "excursion_time": 4.0,
    "full_bias": 0.0,
    "max_runtime": 30.0,
    "min_sample_size": 10,
    "parallel_batch_size": 12,
    "relative_margin_of_error": 0.1,
    "seed": 3158495187,
    "sim_mode": "batch",
    "start_station": 97,
    "use_static_seed": false,
    "warmup_time": 0.0
  },
  "report": "external\\results\\250427_1355_batch.json\n\nBatch Simulation\nReplication Count: 12\nTotal Runtime: 2.953256 seconds\n\nParameters\nAgent Mode: Smart\nStart Station: 97\nEnd Station: 110\nExcursion Time: 4.0 hours\nWarmup Time: 0.0 hours\nEmpty Station Bias: 0.0\nFull Station Bias: 0.0\nConfidence Level: 0.1\nParallel Batch Size: 12\nMin Sample Size: 10 runs\n\nResults\n(Expected values for a single run)\nTotal Reward: 16.889 \u00b1 0.094\nPunctuality: 1.235 \u00b1 0.044 minutes early\nBikes Rented: 38.42 \u00b1 0.14\nTotal Distance Biked: 2.7072 \u00b1 0.0029 km\nTotal Time Biking: 1.2722 \u00b1 0.0023\nTotal Time Walking: 2.7072 \u00b1 0.0029 hours\nTotal Time Waiting: 0.0 \u00b1 0 minutes\nExpected Future Failures: 116.88 \u00b1 0.38\n"
}