{
  "data": [
    {
      "time_left": 1.56,
      "bike_count": 38.29,
      "bike_distance": 19877685.0,
      "bike_time": 1.332,
      "walk_time": 2.636,
      "wait_time": 0.35,
      "reward": 17.1,
      "future_system_fail_count": 113.5
    },
    {
      "time_left": 0.24,
      "bike_count": 0.65,
      "bike_distance": 195784,
      "bike_time": 0.012,
      "walk_time": 0.012,
      "wait_time": 0.22,
      "reward": 0.38,
      "future_system_fail_count": 1.6
    },
    408,
    46.598124980926514
  ],
  "user_parms": {
    "absolute_margin_of_error": 0.1,
    "agent_mode": "smart",
    "batch_mode": "fixed_sample_size",
    "batch_size": 400,
    "confidence_level": 0.99,
    "empty_bias": 0.0,
    "end_station": 25,
    "excursion_time": 4.0,
    "full_bias": 0.0,
    "max_runtime": 120.0,
    "min_sample_size": 300,
    "parallel_batch_size": 12,
    "relative_margin_of_error": 0.1,
    "seed": 3158495187,
    "sim_mode": "batch",
    "start_station": 100,
    "use_static_seed": false,
    "warmup_time": 0.0
  },
  "report": "external\\results\\250427_1903_batch.json\n\nBatch Simulation (fixed sample size)\nReplication Count: 408\nTotal Runtime: 46.598125 seconds\n\nParameters\nAgent Mode: Smart\nStart Station: 100\nEnd Station: 25\nExcursion Time: 4.0 hours\nWarmup Time: 0.0 hours\nEmpty Station Bias: 0.0\nFull Station Bias: 0.0\nConfidence Level: 0.99\nParallel Batch Size: 12\n\nResults\n(Expected values for a single run)\nTotal Reward: 17.1 \u00b1 0.38\nPunctuality: 1.56 \u00b1 0.24 minutes early\nBikes Rented: 38.29 \u00b1 0.65\nTotal Distance Biked: 2.636 \u00b1 0.012 km\nTotal Time Biking: 1.332 \u00b1 0.012 hours\nTotal Time Walking: 2.636 \u00b1 0.012 hours\nTotal Time Waiting: 0.35 \u00b1 0.22 minutes\nExpected Future Failures: 113.5 \u00b1 1.6\n"
}