{
  "data": [
    {
      "time_left": 0.517,
      "bike_count": 38.83,
      "bike_distance": 19559933.0,
      "bike_time": 1.308,
      "walk_time": 2.6718,
      "wait_time": 0.671,
      "reward": 16.77,
      "future_system_fail_count": 114.79
    },
    {
      "time_left": 0.092,
      "bike_count": 0.17,
      "bike_distance": 61201,
      "bike_time": 0.003,
      "walk_time": 0.0023,
      "wait_time": 0.098,
      "reward": 0.12,
      "future_system_fail_count": 0.38
    },
    144,
    13.65224575996399
  ],
  "user_parms": {
    "absolute_margin_of_error": 0.1,
    "agent_mode": "smart",
    "batch_mode": "precision_based",
    "batch_size": 400,
    "confidence_level": 0.4,
    "empty_bias": 0.0,
    "end_station": 110,
    "excursion_time": 4.0,
    "full_bias": 0.0,
    "max_runtime": 30.0,
    "min_sample_size": 100,
    "parallel_batch_size": 12,
    "relative_margin_of_error": 0.1,
    "seed": 3158495187,
    "sim_mode": "batch",
    "start_station": 97,
    "use_static_seed": false,
    "warmup_time": 0.0
  },
  "report": "external/results/250427_1253_batch.json\n\nBatch Simulation\nReplication Count: 144\nTotal Runtime: 13.652246 seconds\n\nParameters\nAgent Mode: Smart\nStart Station: 97\nEnd Station: 110\nExcursion Time: 4.0 hours\nWarmup Time: 0.0 hours\nEmpty Station Bias: 0.0\nFull Station Bias: 0.0\nConfidence Level: 0.4\nParallel Batch Size: 12\nMin Sample Size: 100 runs\n\nResults\n(Expected values for a single run)\nTotal Reward: 16.77 \u00b1 0.12\nPunctuality: 0.517 \u00b1 0.092 minutes early\nBikes Rented: 38.83 \u00b1 0.17\nTotal Distance Biked: 2.6718 \u00b1 0.0023 km\nTotal Time Biking: 1.308 \u00b1 0.003\nTotal Time Walking: 2.6718 \u00b1 0.0023 hours\nTotal Time Waiting: 0.671 \u00b1 0.098 minutes\nExpected Future Failures: 114.79 \u00b1 0.38\n"
}