{
  "data": [
    {
      "time_left": 0.621,
      "bike_count": 37.23,
      "bike_distance": 19210020.0,
      "bike_time": 1.2841,
      "walk_time": 2.6905,
      "wait_time": 0.909,
      "reward": 16.94,
      "future_system_fail_count": 113.46
    },
    {
      "time_left": 0.065,
      "bike_count": 0.17,
      "bike_distance": 34251,
      "bike_time": 0.0021,
      "walk_time": 0.0023,
      "wait_time": 0.099,
      "reward": 0.12,
      "future_system_fail_count": 0.42
    },
    420,
    40.55070900917053
  ],
  "user_parms": {
    "absolute_margin_of_error": 0.1,
    "agent_mode": "smart",
    "batch_mode": "precision_based",
    "batch_size": 300,
    "confidence_level": 0.5,
    "empty_bias": 0.0,
    "end_station": 110,
    "excursion_time": 4.0,
    "full_bias": 0.0,
    "max_runtime": 60.0,
    "min_sample_size": 300,
    "parallel_batch_size": 12,
    "relative_margin_of_error": 0.05,
    "seed": 3158495187,
    "sim_mode": "batch",
    "start_station": 99,
    "use_static_seed": true,
    "warmup_time": 0.0
  },
  "report": "external/results/250425_1354_batch.json\n\nBatch Simulation\nReplication Count: 420\nReal Runtime: 40.550709 seconds\n\nParameters\nAgent Mode: Smart\nStart Station: 99\nEnd Station: 110\nExcursion Time: 4.0 hours\nWarmup Time: 0.0 hours\nEmpty Station Bias: 0.0\nFull Station Bias: 0.0\nConfidence Level: 0.5\nParallel Batch Size: 12\nMin Sample size: 300 runs\n\nResults\n(Expected values for a single run)\nTotal Reward: 16.94 \u00b1 0.12\nPunctuality: 0.621\u00b10.065 minutes early\nBikes Rented: 37.23 \u00b1 0.17\nTotal Distance Biked: 2.6905 \u00b1 0.0023 km\nTotal Time Biking: 1.2841 \u00b1 0.0021\nTotal Time Walking: 2.6905 \u00b1 0.0023 hours\nTotal Time Waiting: 0.909 \u00b1 0.099 minutes\nExpected Future Failures: 113.46 \u00b1 0.42\n"
}