{
  "data": [
    {
      "time_left": 0.495,
      "bike_count": 37.8,
      "bike_distance": 19034033.0,
      "bike_time": 1.2895,
      "walk_time": 2.691,
      "wait_time": 0.684,
      "reward": 17.79,
      "future_system_fail_count": 113.18
    },
    {
      "time_left": 0.066,
      "bike_count": 0.2,
      "bike_distance": 36555,
      "bike_time": 0.0031,
      "walk_time": 0.003,
      "wait_time": 0.088,
      "reward": 0.18,
      "future_system_fail_count": 0.38
    },
    12,
    3.4416937828063965
  ],
  "user_parms": {
    "absolute_margin_of_error": 0.1,
    "agent_mode": "smart",
    "batch_mode": "precision_based",
    "batch_size": 400,
    "confidence_level": 0.1,
    "empty_bias": 0.0,
    "end_station": 25,
    "excursion_time": 4.0,
    "full_bias": 0.0,
    "max_runtime": 30.0,
    "min_sample_size": 10,
    "parallel_batch_size": 12,
    "relative_margin_of_error": 0.1,
    "seed": 3158495187,
    "sim_mode": "batch",
    "start_station": 100,
    "use_static_seed": false,
    "warmup_time": 0.0
  },
  "report": "external\\results\\250427_1439_batch.json\n\nBatch Simulation\nReplication Count: 12\nTotal Runtime: 3.441694 seconds\n\nParameters\nAgent Mode: Smart\nStart Station: 100\nEnd Station: 25\nExcursion Time: 4.0 hours\nWarmup Time: 0.0 hours\nEmpty Station Bias: 0.0\nFull Station Bias: 0.0\nConfidence Level: 0.1\nParallel Batch Size: 12\nMin Sample Size: 10 runs\n\nResults\n(Expected values for a single run)\nTotal Reward: 17.79 \u00b1 0.18\nPunctuality: 0.495 \u00b1 0.066 minutes early\nBikes Rented: 37.8 \u00b1 0.2\nTotal Distance Biked: 2.691 \u00b1 0.003 km\nTotal Time Biking: 1.2895 \u00b1 0.0031\nTotal Time Walking: 2.691 \u00b1 0.003 hours\nTotal Time Waiting: 0.684 \u00b1 0.088 minutes\nExpected Future Failures: 113.18 \u00b1 0.38\n"
}