{
  "data": [
    {
      "time_left": 1.725,
      "bike_count": 37.5,
      "bike_distance": 19736208.0,
      "bike_time": 1.2973,
      "walk_time": 2.6612,
      "wait_time": 0.766,
      "reward": 16.697,
      "future_system_fail_count": 115.94
    },
    {
      "time_left": 0.091,
      "bike_count": 0.18,
      "bike_distance": 57777,
      "bike_time": 0.0025,
      "walk_time": 0.0025,
      "wait_time": 0.099,
      "reward": 0.074,
      "future_system_fail_count": 0.34
    },
    12,
    3.1514408588409424
  ],
  "user_parms": {
    "absolute_margin_of_error": 0.1,
    "agent_mode": "smart",
    "batch_mode": "precision_based",
    "batch_size": 400,
    "confidence_level": 0.1,
    "empty_bias": 0.0,
    "end_station": 25,
    "excursion_time": 4.0,
    "full_bias": 0.0,
    "max_runtime": 30.0,
    "min_sample_size": 10,
    "parallel_batch_size": 12,
    "relative_margin_of_error": 0.1,
    "seed": 3158495187,
    "sim_mode": "batch",
    "start_station": 100,
    "use_static_seed": false,
    "warmup_time": 0.0
  },
  "report": "external\\results\\250427_1836_batch-2.json\n\nBatch Simulation (precision-based)\nReplication Count: 12\nTotal Runtime: 3.151441 seconds\n\nParameters\nAgent Mode: Smart\nStart Station: 100\nEnd Station: 25\nExcursion Time: 4.0 hours\nWarmup Time: 0.0 hours\nEmpty Station Bias: 0.0\nFull Station Bias: 0.0\nConfidence Level: 0.1\nParallel Batch Size: 12\nMin Sample Size: 10 runs\n\nResults\n(Expected values for a single run)\nTotal Reward: 16.697 \u00b1 0.074\nPunctuality: 1.725 \u00b1 0.091 minutes early\nBikes Rented: 37.5 \u00b1 0.18\nTotal Distance Biked: 2.6612 \u00b1 0.0025 km\nTotal Time Biking: 1.2973 \u00b1 0.0025 hours\nTotal Time Walking: 2.6612 \u00b1 0.0025 hours\nTotal Time Waiting: 0.766 \u00b1 0.099 minutes\nExpected Future Failures: 115.94 \u00b1 0.34\n"
}