{
  "data": [
    {
      "time_left": 1.255,
      "bike_count": 38.038,
      "bike_distance": 18917053.0,
      "bike_time": 1.2774,
      "walk_time": 2.69703,
      "wait_time": 0.279,
      "reward": 17.771,
      "future_system_fail_count": 113.247
    },
    {
      "time_left": 0.013,
      "bike_count": 0.039,
      "bike_distance": 10849,
      "bike_time": 0.00062,
      "walk_time": 0.00066,
      "wait_time": 0.013,
      "reward": 0.029,
      "future_system_fail_count": 0.096
    },
    264,
    31.58097243309021
  ],
  "user_parms": {
    "absolute_margin_of_error": 0.1,
    "agent_mode": "smart",
    "batch_mode": "fixed_sample_size",
    "batch_size": 400,
    "confidence_level": 0.1,
    "empty_bias": 0.0,
    "end_station": 110,
    "excursion_time": 4.0,
    "full_bias": 0.0,
    "max_runtime": 30.0,
    "min_sample_size": 10,
    "parallel_batch_size": 12,
    "relative_margin_of_error": 0.1,
    "seed": 3158495187,
    "sim_mode": "batch",
    "start_station": 97,
    "use_static_seed": false,
    "warmup_time": 0.0
  },
  "report": "external\\results\\250427_1359_batch.json\n\nBatch Simulation\nReplication Count: 264\nTotal Runtime: 31.580972 seconds\nWarning: Max runtime exceeded. Target sample size not reached.\n\nParameters\nAgent Mode: Smart\nStart Station: 97\nEnd Station: 110\nExcursion Time: 4.0 hours\nWarmup Time: 0.0 hours\nEmpty Station Bias: 0.0\nFull Station Bias: 0.0\nConfidence Level: 0.1\nParallel Batch Size: 12\n\nResults\n(Expected values for a single run)\nTotal Reward: 17.771 \u00b1 0.029\nPunctuality: 1.255 \u00b1 0.013 minutes early\nBikes Rented: 38.038 \u00b1 0.039\nTotal Distance Biked: 2.69703 \u00b1 0.00066 km\nTotal Time Biking: 1.2774 \u00b1 0.00062\nTotal Time Walking: 2.69703 \u00b1 0.00066 hours\nTotal Time Waiting: 0.279 \u00b1 0.013 minutes\nExpected Future Failures: 113.247 \u00b1 0.096\n"
}